{
  "components": {
    "headers": {
      "PanoApiLevel": {
        "description": "The API level this Pano implements.",
        "schema": {
          "type": "integer"
        }
      }
    },
    "responses": {
      "Error400": {
        "content": {
          "application/json": {
            "schema": {
              "$ref": "#/components/schemas/Error"
            }
          }
        },
        "description": "Bad request: BAD_REQUEST",
        "x-pano-error-codes": [
          "BAD_REQUEST"
        ]
      },
      "Error401": {
        "content": {
          "application/json": {
            "schema": {
              "$ref": "#/components/schemas/Error"
            }
          }
        },
        "description": "Not logged in: NOT_LOGGED_IN",
        "x-pano-error-codes": [
          "NOT_LOGGED_IN"
        ]
      },
      "Error403": {
        "content": {
          "application/json": {
            "schema": {
              "$ref": "#/components/schemas/Error"
            }
          }
        },
        "description": "Forbidden: INVALID_CSRF_TOKEN, NO_PERMISSION",
        "x-pano-error-codes": [
          "INVALID_CSRF_TOKEN",
          "NO_PERMISSION"
        ]
      },
      "Error429": {
        "content": {
          "application/json": {
            "schema": {
              "$ref": "#/components/schemas/Error"
            }
          }
        },
        "description": "Too many requests: RATE_LIMIT_EXCEEDED",
        "x-pano-error-codes": [
          "RATE_LIMIT_EXCEEDED"
        ]
      },
      "Error500": {
        "content": {
          "application/json": {
            "schema": {
              "$ref": "#/components/schemas/Error"
            }
          }
        },
        "description": "Internal server error: INTERNAL_SERVER_ERROR",
        "x-pano-error-codes": [
          "INTERNAL_SERVER_ERROR"
        ]
      },
      "Error503": {
        "content": {
          "application/json": {
            "schema": {
              "$ref": "#/components/schemas/Error"
            }
          }
        },
        "description": "Service unavailable: MAINTENANCE_MODE_ENABLED",
        "x-pano-error-codes": [
          "MAINTENANCE_MODE_ENABLED"
        ]
      }
    },
    "schemas": {
      "Error": {
        "description": "The body of every non-2xx answer.",
        "properties": {
          "error": {
            "properties": {
              "code": {
                "description": "A stable, declared code.",
                "pattern": "^[A-Z][A-Z0-9_]*$",
                "type": "string"
              },
              "details": {
                "additionalProperties": true,
                "description": "Extra facts about the failure.",
                "type": "object"
              },
              "fields": {
                "additionalProperties": {
                  "type": "string"
                },
                "description": "Field name to code, for a rejected form.",
                "type": "object"
              },
              "message": {
                "description": "Optional English text.",
                "type": "string"
              }
            },
            "required": [
              "code"
            ],
            "type": "object"
          }
        },
        "required": [
          "error"
        ],
        "type": "object"
      },
      "Locale": {
        "properties": {
          "code": {
            "type": "string"
          },
          "createdAt": {
            "type": "integer"
          },
          "dateFnsCode": {
            "type": "string"
          },
          "definedBy": {
            "enum": [
              "SYSTEM",
              "USER"
            ]
          },
          "derivatives": {
            "items": {
              "type": "string"
            },
            "type": "array"
          },
          "id": {
            "type": "integer"
          },
          "name": {
            "type": "string"
          },
          "updatedAt": {
            "type": "integer"
          }
        },
        "required": [
          "code",
          "dateFnsCode",
          "derivatives",
          "id",
          "name"
        ],
        "type": "object"
      },
      "Notification": {
        "properties": {
          "createdAt": {
            "type": "integer"
          },
          "details": {
            "type": "object"
          },
          "id": {
            "type": "integer"
          },
          "isPersonal": {
            "type": "boolean"
          },
          "pluginId": {
            "type": [
              "string",
              "null"
            ]
          },
          "status": {
            "enum": [
              "NOT_READ",
              "READ"
            ]
          },
          "type": {
            "type": "string"
          },
          "updatedAt": {
            "type": "integer"
          }
        },
        "required": [
          "createdAt",
          "details",
          "id",
          "isPersonal",
          "pluginId",
          "status",
          "type",
          "updatedAt"
        ],
        "type": "object"
      },
      "Page": {
        "description": "Where a list stands: page numbers start at 1, `pageSize` is at most 100.",
        "properties": {
          "number": {
            "minimum": 1,
            "type": "integer"
          },
          "size": {
            "minimum": 1,
            "type": "integer"
          },
          "totalItems": {
            "minimum": 0,
            "type": "integer"
          },
          "totalPages": {
            "minimum": 0,
            "type": "integer"
          }
        },
        "required": [
          "number",
          "size",
          "totalItems",
          "totalPages"
        ],
        "type": "object"
      },
      "Post": {
        "properties": {
          "category": {
            "properties": {
              "color": {
                "type": "string"
              },
              "description": {
                "type": "string"
              },
              "id": {
                "type": "integer"
              },
              "title": {
                "type": "string"
              },
              "url": {
                "type": "string"
              }
            },
            "required": [
              "title"
            ],
            "type": "object"
          },
          "date": {
            "type": "integer"
          },
          "id": {
            "type": "integer"
          },
          "status": {
            "enum": [
              "PUBLISHED",
              "DRAFT",
              "TRASH"
            ]
          },
          "text": {
            "type": "string"
          },
          "thumbnailUrl": {
            "type": "string"
          },
          "title": {
            "type": "string"
          },
          "url": {
            "type": "string"
          },
          "views": {
            "type": "integer"
          },
          "writer": {
            "properties": {
              "username": {
                "type": "string"
              }
            },
            "required": [
              "username"
            ],
            "type": "object"
          }
        },
        "required": [
          "category",
          "date",
          "id",
          "status",
          "text",
          "thumbnailUrl",
          "title",
          "url",
          "views",
          "writer"
        ],
        "type": "object"
      },
      "PostDetail": {
        "properties": {
          "nextPost": {
            "anyOf": [
              {
                "type": "string"
              },
              {
                "properties": {
                  "id": {
                    "type": "integer"
                  },
                  "title": {
                    "type": "string"
                  },
                  "url": {
                    "type": "string"
                  }
                },
                "required": [
                  "id",
                  "title",
                  "url"
                ],
                "type": "object"
              }
            ]
          },
          "post": {
            "$ref": "#/components/schemas/Post"
          },
          "previousPost": {
            "anyOf": [
              {
                "type": "string"
              },
              {
                "properties": {
                  "id": {
                    "type": "integer"
                  },
                  "title": {
                    "type": "string"
                  },
                  "url": {
                    "type": "string"
                  }
                },
                "required": [
                  "id",
                  "title",
                  "url"
                ],
                "type": "object"
              }
            ]
          }
        },
        "required": [
          "nextPost",
          "post",
          "previousPost"
        ],
        "type": "object"
      },
      "PostSummary": {
        "properties": {
          "category": {
            "properties": {
              "color": {
                "type": "string"
              },
              "description": {
                "type": "string"
              },
              "id": {
                "type": "integer"
              },
              "title": {
                "type": "string"
              },
              "url": {
                "type": "string"
              }
            },
            "required": [
              "title"
            ],
            "type": "object"
          },
          "date": {
            "type": "integer"
          },
          "id": {
            "type": "integer"
          },
          "text": {
            "type": "string"
          },
          "thumbnailUrl": {
            "type": "string"
          },
          "title": {
            "type": "string"
          },
          "url": {